l1,l2,l3
Ron and Baker Ethanol Propanol Hand Sanitizer (Pack of ,Rs.490                                             ,https://cdn.shopclues.com/images1/thumbnails/105959/200/200/149411339-105959195-1588083182.jpg
"Maxshield Alcohol Based Hand Sanitizer, 100ml (Pack of ",Rs.199                                             ,https://cdn.shopclues.com/images1/thumbnails/106344/200/200/149557493-106344308-1589219147.jpg
viewshoppers Hand Sanitizer - Alcohol Base Lemon Saniti,Rs.255                                             ,https://cdn.shopclues.com/images1/thumbnails/105518/200/200/149253147-105518153-1584881430.jpg
SPASTRAT Sanitizer 100ml pack of 50,Rs.2500                                             ,https://cdn.shopclues.com/images1/thumbnails/106044/200/200/149440699-106044777-1588008277.jpg
Aryanveda Bodyguard Hand Sanitizer 500 ML/Bottle ( Pack,Rs.899                                             ,//cdn.shopclues.com//images/ui/plistlogo.png
Trendy Trotters Buy 2 Face Dust Face Mask Ear Loop Medi,Rs.89                                             ,//cdn.shopclues.com//images/ui/plistlogo.png
Prowomen Toilet Seat Sanitizer (1st No Gas Toilet Seat ,Rs.299                                             ,//cdn.shopclues.com//images/ui/plistlogo.png
Trendy Trotters Buy 2 Face Dust Face Mask Ear Loop Medi,Rs.179                                             ,//cdn.shopclues.com//images/ui/plistlogo.png
Smarty Twomax Classic Hand Sanitizer 1000ml,Rs.500                                             ,//cdn.shopclues.com//images/ui/plistlogo.png
Treatment Infection Control Alcoholic Hand Sanitizer 50,Rs.580                                             ,//cdn.shopclues.com//images/ui/plistlogo.png
Purell Treatment Infection Control Alcoholic Hand Sanit,Rs.499                                             ,//cdn.shopclues.com//images/ui/plistlogo.png
Trendy Trotters Kills Germs No-Rinse Wash Hand Gel Hand,Rs.529                                             ,//cdn.shopclues.com//images/ui/plistlogo.png
